{
  "id": "room-link-revoke",
  "name": "Rooms: Revoke guest link",
  "nodes": {
    "checkname": {
      "type": "control.if",
      "config": { "condition": "{{ input.name matches '^hb-(meet|stream)-[a-z0-9]{8}$' }}" }
    },
    "del": {
      "type": "db.delete",
      "services": { "database": "main-db" },
      "config": { "table": "room_links", "where": { "room_name": "{{ input.name }}" } }
    },
    "respond": {
      "type": "response.json",
      "config": { "status": 204 }
    },
    "respond_badname": {
      "type": "response.error",
      "config": { "status": 404, "code": "NOT_FOUND", "message": "room not found" }
    }
  },
  "edges": [
    { "from": "checkname", "output": "then", "to": "del" },
    { "from": "checkname", "output": "else", "to": "respond_badname" },
    { "from": "del", "to": "respond" }
  ]
}
