{
  "id": "share-revoke",
  "name": "Shares: Revoke link",
  "nodes": {
    "del": {
      "type": "db.delete",
      "services": { "database": "main-db" },
      "config": { "table": "share_links", "where": { "id": "{{ input.share_id }}" } }
    },
    "check": {
      "type": "control.if",
      "config": { "condition": "{{ nodes.del.rows_affected > 0 }}" }
    },
    "respond": {
      "type": "response.json",
      "config": { "status": 204 }
    },
    "respond_missing": {
      "type": "response.error",
      "config": { "status": 404, "code": "NOT_FOUND", "message": "share not found" }
    }
  },
  "edges": [
    { "from": "del", "to": "check" },
    { "from": "check", "output": "then", "to": "respond" },
    { "from": "check", "output": "else", "to": "respond_missing" }
  ]
}
