{
  "id": "drop-update",
  "name": "Drops: Edit text",
  "nodes": {
    "update": {
      "type": "db.update",
      "services": { "database": "main-db" },
      "config": {
        "table": "drops",
        "data": { "text": "{{ input.text }}", "updated_at": "{{ now() }}" },
        "where": { "id": "{{ input.id }}" }
      }
    },
    "check": {
      "type": "control.if",
      "config": { "condition": "{{ nodes.update.rows_affected > 0 }}" }
    },
    "fetch": {
      "type": "db.findOne",
      "services": { "database": "main-db" },
      "config": {
        "table": "drops",
        "select": ["id", "text", "file_name", "file_size", "file_mime", "created_at", "updated_at"],
        "where": { "id": "{{ input.id }}" },
        "required": true
      }
    },
    "respond": {
      "type": "response.json",
      "config": { "status": 200, "body": "{{ nodes.fetch }}" }
    },
    "respond_missing": {
      "type": "response.error",
      "config": { "status": 404, "code": "NOT_FOUND", "message": "drop not found" }
    }
  },
  "edges": [
    { "from": "update", "to": "check" },
    { "from": "check", "output": "then", "to": "fetch" },
    { "from": "check", "output": "else", "to": "respond_missing" },
    { "from": "fetch", "to": "respond" }
  ]
}
