{
  "id": "list-participants",
  "name": "List Participants",
  "nodes": {
    "get_participants": {
      "type": "lk.participant_list",
      "services": { "livekit": "lk" },
      "config": {
        "room": "{{ input.room }}"
      }
    },
    "respond": {
      "type": "response.json",
      "config": {
        "status": 200,
        "body": {
          "participants": "{{ nodes.get_participants.participants }}"
        }
      }
    }
  },
  "edges": [
    { "from": "get_participants", "to": "respond" }
  ]
}
